Age,Occupation,Annual Income,Improvements,lemmatised_content,tokenized_content,remove_stopwords_content,pos_tag_content,final_content
21 years old and under,student,no income,expensive for me as a student maybe can have monthly subscription plans,expensive for  as a student maybe can have monthly subscription plan,"['expensive', 'for', 'as', 'a', 'student', 'maybe', 'can', 'have', 'monthly', 'subscription', 'plan']","['expensive', 'student', 'maybe', 'monthly', 'subscription']","['expensive', 'monthly', 'student', 'subscription']",expensive monthly student subscription
21 years old and under,student,no income,have more categories and types of insurance for different age groups,have more category and type of insurance for different age group,"['have', 'more', 'category', 'and', 'type', 'of', 'insurance', 'for', 'different', 'age', 'group']","['category', 'type', 'different', 'age', 'group']","['different', 'category', 'type', 'age', 'group']",different category type age group
21 years old and under,student,"$25,000 and below",offer travel insurance ,offer travel insurance,"['offer', 'travel', 'insurance']","['offer', 'travel']","['offer', 'travel']",offer travel
21 years old and under,student,no income,have more types,have more type,"['have', 'more', 'type']",['type'],['type'],type
21 years old and under,student,"$25,000 and below",cheaper prices ,cheap price,"['cheap', 'price']","['cheap', 'price']","['cheap', 'price']",cheap price
21 years old and under,student,"$25,000 and below",investment insurance ,investment insurance,"['investment', 'insurance']",['investment'],['investment'],investment
21 years old and under,student,"$25,000 and below",offer different and unique products,offer different and unique product,"['offer', 'different', 'and', 'unique', 'product']","['offer', 'different', 'unique', 'product']","['different', 'unique', 'offer', 'product']",different unique offer product
21 years old and under,student,no income,they do not stand out maybe do more promotions, do not stand out maybe do more promotion,"['do', 'not', 'stand', 'out', 'maybe', 'do', 'more', 'promotion']","['stand', 'maybe', 'promotion']","['stand', 'promotion']",stand promotion
22 to 36 years old,student,no income,no attractive benefits for young people like me,no attractive benefit for young people like ,"['no', 'attractive', 'benefit', 'for', 'young', 'people', 'like']","['attractive', 'benefit', 'young', 'people', 'like']","['attractive', 'young', 'benefit', 'people']",attractive young benefit people
22 to 36 years old,student,no income,more variety of policies to choose from instead of the usual normal ones ntuc income has alot more they have something for grab eg you buy a policy when you think it is going to rain on a certain day and if it really rains ntuc will pay for your grab ride expenses this is really interesting and also beneficial because there are a lot of grab users out there,more variety of policy to choose from instead of the usual normal one ntuc income have alot more  have something for grab eg  buy a policy when  think  be go to rain on a certain day and if  really rain ntuc will pay for  grab ride expense this be really interesting and also beneficial because there be a lot of grab user out there,"['more', 'variety', 'of', 'policy', 'to', 'choose', 'from', 'instead', 'of', 'the', 'usual', 'normal', 'one', 'ntuc', 'income', 'have', 'alot', 'more', 'have', 'something', 'for', 'grab', 'eg', 'buy', 'a', 'policy', 'when', 'think', 'be', 'go', 'to', 'rain', 'on', 'a', 'certain', 'day', 'and', 'if', 'really', 'rain', 'ntuc', 'will', 'pay', 'for', 'grab', 'ride', 'expense', 'this', 'be', 'really', 'interesting', 'and', 'also', 'beneficial', 'because', 'there', 'be', 'a', 'lot', 'of', 'grab', 'user', 'out', 'there']","['variety', 'choose', 'instead', 'usual', 'normal', 'one', 'ntuc', 'income', 'alot', 'something', 'grab', 'eg', 'buy', 'think', 'go', 'rain', 'certain', 'day', 'really', 'rain', 'ntuc', 'pay', 'grab', 'ride', 'expense', 'really', 'interesting', 'also', 'beneficial', 'lot', 'grab', 'user']","['usual', 'normal', 'ntuc', 'rain', 'certain', 'ntuc', 'beneficial', 'variety', 'choose', 'income', 'alot', 'something', 'grab', 'day', 'pay', 'grab', 'ride', 'expense', 'lot', 'grab']",usual normal ntuc rain certain ntuc beneficial variety choose income alot something grab day pay grab ride expense lot grab
22 to 36 years old,student,no income,i dont know much about their policies maybe more marketing by then on social media,i do not know much about  policy maybe more marketing by then on social medium,"['i', 'do', 'not', 'know', 'much', 'about', 'policy', 'maybe', 'more', 'marketing', 'by', 'then', 'on', 'social', 'medium']","['know', 'much', 'maybe', 'marketing', 'social', 'medium']","['much', 'social', 'medium']",much social medium
22 to 36 years old,student,no income,do more online marketing instead of road shows especially during this pandemic ,do more online marketing instead of road show especially during this pandemic,"['do', 'more', 'online', 'marketing', 'instead', 'of', 'road', 'show', 'especially', 'during', 'this', 'pandemic']","['online', 'marketing', 'instead', 'road', 'show', 'especially', 'pandemic']","['online', 'pandemic', 'marketing', 'road', 'show']",online pandemic marketing road show
21 years old and under,student,no income,ease of search for information about their policies online,ease of search for information about  policy online,"['ease', 'of', 'search', 'for', 'information', 'about', 'policy', 'online']","['ease', 'search', 'information', 'online']","['ease', 'search', 'information', 'online']",ease search information online
21 years old and under,student,no income,public transport breakdown insurance,public transport breakdown insurance,"['public', 'transport', 'breakdown', 'insurance']","['public', 'transport', 'breakdown']","['public', 'transport', 'breakdown']",public transport breakdown
22 to 36 years old,student,"$25,000 and below",micro insurance,micro insurance,"['micro', 'insurance']",['micro'],['micro'],micro
22 to 36 years old,student,no income,less pushy,less pushy,"['less', 'pushy']","['less', 'pushy']",['pushy'],pushy
22 to 36 years old,student,no income,more engaging,more engaging,"['more', 'engaging']",['engaging'],[],
22 to 36 years old,student,no income,more interaction with customer,more interaction with customer,"['more', 'interaction', 'with', 'customer']","['interaction', 'customer']","['interaction', 'customer']",interaction customer
22 to 36 years old,salesperson,"$25,001 to $50,000",be more professional,be more professional,"['be', 'more', 'professional']",['professional'],['professional'],professional
22 to 36 years old,accountant,"$25,001 to $50,000",i think theyre good but they need to be more informative ,i think  be good but  need to be more informative,"['i', 'think', 'be', 'good', 'but', 'need', 'to', 'be', 'more', 'informative']","['think', 'good', 'need', 'informative']","['good', 'informative', 'need']",good informative need
22 to 36 years old,student,"$25,000 and below",needs to appeal to the wealthier customers,need to appeal to the wealthy customer,"['need', 'to', 'appeal', 'to', 'the', 'wealthy', 'customer']","['need', 'appeal', 'wealthy', 'customer']","['wealthy', 'need', 'appeal', 'customer']",wealthy need appeal customer
22 to 36 years old,student,no income,i think theyre quite good but i need more information,i think  be quite good but i need more information,"['i', 'think', 'be', 'quite', 'good', 'but', 'i', 'need', 'more', 'information']","['think', 'quite', 'good', 'need', 'information']","['good', 'need', 'information']",good need information
22 to 36 years old,student,no income,more targeted in terms of customer segments and not just ordinary policies that can be offered to everyone,more target in term of customer segment and not just ordinary policy that can be offer to everyone,"['more', 'target', 'in', 'term', 'of', 'customer', 'segment', 'and', 'not', 'just', 'ordinary', 'policy', 'that', 'can', 'be', 'offer', 'to', 'everyone']","['target', 'term', 'customer', 'segment', 'ordinary', 'offer', 'everyone']","['ordinary', 'target', 'term', 'customer', 'segment', 'offer', 'everyone']",ordinary target term customer segment offer everyone
